title,heading,content,tokens
Human nutrition,Nutrients,"The seven major classes of nutrients are carbohydrates, fats, fiber, minerals, proteins, vitamins, and water. Nutrients can be grouped as either macronutrients or micronutrients (needed in small quantities). Carbohydrates, fats, and proteins are macronutrients, and provide energy. Water and fiber are macronutrients but do not provide energy. The micronutrients are minerals and vitamins.The macronutrients (excluding fiber and water) provide structural material (amino acids from which proteins are built, and lipids from which cell membranes and some signaling molecules are built), and energy. Some of the structural material can also be used to generate energy internally, and in either case it is measured in Joules or kilocalories (often called ""Calories"" and written with a capital 'C' to distinguish them from little 'c' calories). Carbohydrates and proteins provide 17 kJ approximately (4 kcal) of energy per gram, while fats provide 37 kJ (9 kcal) per gram, though the net energy from either depends on such factors as absorption and digestive effort, which vary substantially from instance to instance.
Vitamins, minerals, fiber, and water do not provide energy, but are required for other reasons. A third class of dietary material, fiber (i.e., nondigestible material such as cellulose), seems also to be required, for both mechanical and biochemical reasons, though the exact reasons remain unclear. For all age groups, males on average need to consume higher amounts of macronutrients than females. In general, intakes increase with age until the second or third decade of life.Some nutrients can be stored – the fat-soluble vitamins – while others are required more or less continuously. Poor health can be caused by a lack of required nutrients, or for some vitamins and minerals, too much of a required nutrient. Essential nutrients cannot be synthesized by the body, and must be obtained from food.
Molecules of carbohydrates and fats consist of carbon, hydrogen, and oxygen atoms. Carbohydrates range from simple monosaccharides (glucose, fructose, galactose) to complex polysaccharides (starch). Fats are triglycerides, made of assorted fatty acid monomers bound to a glycerol backbone. Some fatty acids, but not all, are essential in the diet: they cannot be synthesized in the body. Protein molecules contain nitrogen atoms in addition to carbon, oxygen, and hydrogen. The fundamental components of protein are nitrogen-containing amino acids, some of which are essential in the sense that humans cannot make them internally. Some of the amino acids are convertible (with the expenditure of energy) to glucose and can be used for energy production just as ordinary glucose, in a process known as gluconeogenesis. By breaking down existing protein, some glucose can be produced internally; the remaining amino acids are discarded, primarily as urea in urine. This occurs naturally when atrophy takes place, or during periods of starvation.The list of nutrients that people are known to require is, in the words of Marion Nestle, ""almost certainly incomplete"".",647
Human nutrition,Carbohydrates,"Carbohydrates may be classified as monosaccharides, disaccharides or polysaccharides depending on the number of monomer (sugar) units they contain. They are a diverse group of substances, with a range of chemical, physical and physiological properties. They make up a large part of foods such as rice, noodles, bread, and other grain-based products, but they are not an essential nutrient, meaning a human does not need to eat carbohydrates.Monosaccharides contain one sugar unit, disaccharides two, and polysaccharides three or more. Monosaccharides include glucose, fructose and galactose. Disaccharides include sucrose, lactose, and maltose; purified sucrose, for instance, is used as table sugar. Polysaccharides, which include starch and glycogen, are often referred to as 'complex' carbohydrates because they are typically long multiple-branched chains of sugar units.
Traditionally, simple carbohydrates were believed to be absorbed quickly, and therefore raise blood-glucose levels more rapidly than complex carbohydrates. This is inaccurate. Some simple carbohydrates (e.g., fructose) follow different metabolic pathways (e.g., fructolysis) that result in only a partial catabolism to glucose, while, in essence, many complex carbohydrates may be digested at the same rate as simple carbohydrates. The World Health Organization recommends that added sugars should represent no more than 10% of total energy intake.The most common plant carbohydrate nutrient – starch – varies in its absorption. Starches have been classified as rapidly digestible starch, slowly digestible starch and resistant starch. Starches in plants are resistant to digestion (resistant starch), but cooking the starch in the presence of water can break down the starch granule and releases the glucose chains, making them more easily digestible by human digestive enzymes. Historically, food was less processed and starches were contained within the food matrix, making them less digestible. Modern food processing has shifted carbohydrate consumption from less digestible and resistant starch to much more rapidly digestible starch. For instance, the resistant starch content of a traditional African diet was 38 grams/day. The resistant starch consumption from countries with high starch intakes has been estimated to be 30-40 grams/day. In contrast, the average consumption of resistant starch in the United States was estimated to be 4.9 grams/day (range 2.8-7.9 grams of resistant starch/day).",514
Human nutrition,Fat,"A molecule of dietary fat typically consists of several fatty acids (containing long chains of carbon and hydrogen atoms), bonded to a glycerol. They are typically found as triglycerides (three fatty acids attached to one glycerol backbone). Fats may be classified as saturated or unsaturated depending on the chemical structure of the fatty acids involved. Saturated fats have all of the carbon atoms in their fatty acid chains bonded to hydrogen atoms, whereas unsaturated fats have some of these carbon atoms double-bonded, so their molecules have relatively fewer hydrogen atoms than a saturated fatty acid of the same length. Unsaturated fats may be further classified as monounsaturated (one double-bond) or polyunsaturated (many double-bonds). Furthermore, depending on the location of the double-bond in the fatty acid chain, unsaturated fatty acids are classified as omega-3 or omega-6 fatty acids. Trans fats are a type of unsaturated fat with trans-isomer bonds; these are rare in nature and in foods from natural sources; they are typically created in an industrial process called (partial) hydrogenation. There are nine kilocalories in each gram of fat. Fatty acids such as conjugated linoleic acid, catalpic acid, eleostearic acid and punicic acid, in addition to providing energy, represent potent immune modulatory molecules.
Saturated fats (typically from animal sources) have been a staple in many world cultures for millennia. Unsaturated fats (e. g., vegetable oil) are considered healthier, while trans fats are to be avoided. Saturated and some trans fats are typically solid at room temperature (such as butter or lard), while unsaturated fats are typically liquids (such as olive oil or flaxseed oil). Trans fats are very rare in nature, and have been shown to be highly detrimental to human health, but have properties useful in the food processing industry, such as rancidity resistance.",406
Human nutrition,Essential fatty acids,"Most fatty acids are non-essential, meaning the body can produce them as needed, generally from other fatty acids and always by expending energy to do so. However, in humans, at least two fatty acids are essential and must be included in the diet. An appropriate balance of essential fatty acids—omega-3 and omega-6 fatty acids—seems also important for health, although definitive experimental demonstration has been elusive. Both of these ""omega"" long-chain polyunsaturated fatty acids are substrates for a class of eicosanoids known as prostaglandins, which have roles throughout the human body.
The omega-3 eicosapentaenoic acid (EPA), which can be made in the human body from the omega-3 essential fatty acid alpha-linolenic acid (ALA), or taken in through marine food sources, serves as a building block for series 3 prostaglandins (e.g., weakly inflammatory PGE3). The omega-6 dihomo-gamma-linolenic acid (DGLA) serves as a building block for series 1 prostaglandins (e.g. anti-inflammatory PGE1), whereas arachidonic acid (AA) serves as a building block for series 2 prostaglandins (e.g. pro-inflammatory PGE 2). Both DGLA and AA can be made from the omega-6 linoleic acid (LA) in the human body, or can be taken in directly through food. An appropriately balanced intake of omega-3 and omega-6 partly determines the relative production of different prostaglandins. In industrialized societies, people typically consume large amounts of processed vegetable oils, which have reduced amounts of the essential fatty acids along with too much of omega-6 fatty acids relative to omega-3 fatty acids.
The conversion rate of omega-6 DGLA to AA largely determines the production of the prostaglandins PGE1 and PGE2. Omega-3 EPA prevents AA from being released from membranes, thereby skewing prostaglandin balance away from pro-inflammatory PGE2 (made from AA) toward anti-inflammatory PGE1 (made from DGLA). The conversion (desaturation) of DGLA to AA is controlled by the enzyme delta-5-desaturase, which in turn is controlled by hormones such as insulin (up-regulation) and glucagon (down-regulation).",510
Human nutrition,Fiber,"Dietary fiber is a carbohydrate, specifically a polysaccharide, which is incompletely absorbed in humans and in some animals. Like all carbohydrates, when it is metabolized, it can produce four Calories (kilocalories) of energy per gram, but in most circumstances, it accounts for less than that because of its limited absorption and digestibility.
The two subcategories are insoluble and soluble fiber.

Insoluble dietary fiber
Includes cellulose, a large carbohydrate polymer that is indigestible by humans, because humans do not have the required enzymes to break it down, and the human digestive system does not harbor enough of the types of microbes that can do so.
Includes resistant starch, an insoluble starch that resists digestion either because it is protected by a shell or food matrix (Type 1 resistant starch, RS1), maintains the natural starch granule (Type 2 resistant starch, RS2), is retrograded and partially crystallized (Type 3 resistant starch, RS3), has been chemically modified (Type 4 resistant starch, RS4) or has complexed with a lipid (Type 5 resistant starch, RS5). Natural sources of resistant starch (RS1, RS2 and RS3) are fermented by the microbes in the human digestive system to produce short-chain fatty acids which are utilized as food for the colonic cells or absorbed.Soluble dietary fiber
Comprises a variety of oligosaccharides, waxes, esters, and other carbohydrates that dissolve or gelatinize in water. Many of these soluble fibers can be fermented or partially fermented by microbes in the human digestive system to produce short-chain fatty acids which are absorbed and therefore introduce some caloric content.Whole grains, beans, and other legumes, fruits (especially plums, prunes, and figs), and vegetables are good sources of dietary fiber. Fiber has three primary mechanisms, which in general determine their health impact: bulking, viscosity and fermentation. Fiber provides bulk to the intestinal contents, and insoluble fiber facilitates peristalsis – the rhythmic muscular contractions of the intestines which move contents along the digestive tract. Some soluble and insoluble fibers produce a solution of high viscosity; this is essentially a gel, which slows the movement of food through the intestines. Fermentable fibers are used as food by the microbiome, mildly increasing bulk, and producing short-chain fatty acids and other metabolites, including vitamins, hormones, and glucose. One of these metabolites, butyrate, is important as an energy source for colon cells, and may improve metabolic syndrome.In 2016, the U.S. FDA approved a qualified health claim stating that resistant starch might reduce the risk of type 2 diabetes, but with qualifying language for product labels that only limited scientific evidence exists to support this claim. The FDA requires specific labeling language, such as the guideline concerning resistant starch: ""High-amylose maize resistant starch may reduce the risk of type 2 diabetes. FDA has concluded that there is limited scientific evidence for this claim.""",625
Human nutrition,Amino acids,"Proteins are the basis of many animal body structures (e.g. muscles, skin, and hair) and form the enzymes that control chemical reactions throughout the body. Each protein molecule is composed of amino acids which contain nitrogen and sometimes sulphur (these components are responsible for the distinctive smell of burning protein, such as the keratin in hair). The body requires amino acids to produce new proteins (protein retention) and to replace damaged proteins (maintenance). Amino acids are soluble in the digestive juices within the small intestine, where they are absorbed into the blood. Once absorbed, they cannot be stored in the body, so they are either metabolized as required or excreted in the urine. Proteins consist of amino acids in different proportions. The most important aspect and defining characteristic of protein from a nutritional standpoint is its amino acid composition.For all animals, some amino acids are essential (an animal cannot produce them internally so they must be eaten) and some are non-essential (the animal can produce them from other nitrogen-containing compounds). About twenty amino acids are found in the human body, and about ten of these are essential. The synthesis of some amino acids can be limited under special pathophysiological conditions, such as prematurity in the infant or individuals in severe catabolic distress, and those are called conditionally essential.A diet that contains adequate amounts of amino acids (especially those that are essential) is particularly important in some situations: during early development and maturation, pregnancy, lactation, or injury (a burn, for instance). A complete protein source contains all the essential amino acids; an incomplete protein source lacks one or more of the essential amino acids. It is possible with protein combinations of two incomplete protein sources (e.g., rice and beans) to make a complete protein source, and characteristic combinations are the basis of distinct cultural cooking traditions. However, complementary sources of protein do not need to be eaten at the same meal to be used together by the body. Excess amino acids from protein can be converted into glucose and used for fuel through a process called gluconeogenesis.
There is an ongoing debate about the differences in nutritional quality and adequacy of protein from vegan, vegetarian and animal sources, though many studies and institutions have found that a well-planned vegan or vegetarian diet contains enough high-quality protein to support the protein requirements of both sedentary and active people at all stages of life.",495
Human nutrition,Water,"Water is excreted from the body in multiple forms; including urine and feces, sweating, and by water vapour in the exhaled breath. Therefore, it is necessary to adequately rehydrate to replace lost fluids.
Early recommendations for the quantity of water required for maintenance of good health suggested that six to eight glasses of water daily is the minimum to maintain proper hydration. However, the notion that a person should consume eight glasses of water per day cannot be traced to a credible scientific source. The original water intake recommendation in 1945 by the Food and Nutrition Board of the National Research Council read: ""An ordinary standard for diverse persons is 1 milliliter for each calorie of food. Most of this quantity is contained in prepared foods."" More recent comparisons of well-known recommendations on fluid intake have revealed large discrepancies in the volumes of water we need to consume for good health. Therefore, to help standardize guidelines, recommendations for water consumption are included in two recent European Food Safety Authority (EFSA) documents (2010): (i) Food-based dietary guidelines and (ii) Dietary reference values for water or adequate daily intakes (ADI). These specifications were provided by calculating adequate intakes from measured intakes in populations of individuals with ""desirable osmolarity values of urine and desirable water volumes per energy unit consumed.""For healthful hydration, the current EFSA guidelines recommend total water intakes of 2.0 L/day for adult females and 2.5 L/day for adult males. These reference values include water from drinking water, other beverages, and from food. About 80% of our daily water requirement comes from the beverages we drink, with the remaining 20% coming from food. Water content varies depending on the type of food consumed, with fruit and vegetables containing more than cereals, for example. These values are estimated using country-specific food balance sheets published by the Food and Agriculture Organisation of the United Nations.The EFSA panel also determined intakes for different populations. Recommended intake volumes in the elderly are the same as for adults as despite lower energy consumption, the water requirement of this group is increased due to a reduction in renal concentrating capacity. Pregnant and breastfeeding women require additional fluids to stay hydrated. The EFSA panel proposes that pregnant women should consume the same volume of water as non-pregnant women, plus an increase in proportion to the higher energy requirement, equal to 300 mL/day. To compensate for additional fluid output, breastfeeding women require an additional 700 mL/day above the recommended intake values for non-lactating women. Dehydration and over-hydration – too little and too much water, respectively – can have harmful consequences. Drinking too much water is one of the possible causes of hyponatremia, i.e., low serum sodium.",570
Human nutrition,Minerals,"Dietary minerals are inorganic chemical elements required by living organisms, other than the four elements carbon, hydrogen, nitrogen, and oxygen that are present in nearly all organic molecules. Some have roles as cofactors, while others are electrolytes. The term ""mineral"" is archaic, since the intent is to describe simply the less common elements in the diet. Some are heavier than the four just mentioned – including several metals, which often occur as ions in the body. Some dietitians recommend that these be supplied from foods in which they occur naturally, or at least as complex compounds, or sometimes even from natural inorganic sources (such as calcium carbonate from ground oyster shells). Some are absorbed much more readily in the ionic forms found in such sources. On the other hand, minerals are often artificially added to the diet as supplements; the most well-known is likely iodine in iodized salt which prevents goiter.",192
Human nutrition,Macrominerals,"Elements with recommended dietary allowance (RDA) greater than 150 mg/day are, in alphabetical order:

Calcium (Ca2+) is vital to the health of the muscular, circulatory, and digestive systems; is indispensable to the building of bone; and supports the synthesis and function of blood cells. For example, calcium is used to regulate the contraction of muscles, nerve conduction, and the clotting of blood. It can play this role because the Ca2+ ion forms stable coordination complexes with many organic compounds, especially proteins; it also forms compounds with a wide range of solubility, enabling the formation of the skeleton.
Chlorine as chloride ions; very common electrolyte; see sodium, below.
Magnesium, required for processing ATP and related reactions (builds bone, causes strong peristalsis, increases flexibility, increases alkalinity). Approximately 50% is in bone, the remaining 50% is almost all inside body cells, with only about 1% located in extracellular fluid. Food sources include oats, buckwheat, tofu, nuts, caviar, green leafy vegetables, legumes, and chocolate.
Phosphorus, required component of bones; essential for energy processing. Approximately 80% is found in the inorganic portion of bones and teeth. Phosphorus is a component of every cell, as well as important metabolites, including DNA, RNA, ATP, and phospholipids. Also important in pH regulation. It is an important electrolyte in the form of phosphate. Food sources include cheese, egg yolk, milk, meat, fish, poultry, whole-grain cereals, and many others.
Potassium, a common electrolyte (heart and nerve function). With sodium, potassium is involved in maintaining normal water balance, osmotic equilibrium, and acid-base balance. In addition to calcium, it is important in the regulation of neuromuscular activity. Food sources include bananas, avocados, nuts, vegetables, potatoes, legumes, fish, and mushrooms.
Sodium, a common food ingredient and electrolyte, found in most foods and manufactured consumer products, typically as sodium chloride (salt). Excessive sodium consumption can deplete calcium and magnesium. Sodium has a role in the etiology of hypertension demonstrated from studies showing that a reduction of table salt intake may reduce blood pressure.",489
Human nutrition,Trace minerals,"Many elements are required in smaller amounts (microgram quantities), usually because they play a catalytic role in enzymes. Some trace mineral elements (RDA < 200 mg/day) are, in alphabetical order:
Cobalt as a component of the vitamin B12 family of coenzymes
Copper required component of many redox enzymes, including cytochrome c oxidase (see Copper in health)
Chromium required for sugar metabolism
Iodine required not only for the biosynthesis of thyroxin, but probably, for other important organs as breast, stomach, salivary glands, thymus etc. (see Iodine deficiency); for this reason iodine is needed in larger quantities than others in this list, and sometimes classified with the macrominerals; Nowadays it is most easily found in iodized salt, but there are also natural sources such as Kombu.
Iron required for many enzymes, and for hemoglobin and some other proteins
Manganese (processing of oxygen)
Molybdenum required for xanthine oxidase and related oxidases
Selenium required for peroxidase (antioxidant proteins)
Zinc required for several enzymes such as carboxypeptidase, liver alcohol dehydrogenase, carbonic anhydrase",272
Human nutrition,Ultratrace minerals,"Ultratrace minerals are an as yet unproven aspect of human nutrition, and may be required at amounts measured in very low ranges of μg/day. Many ultratrace elements have been suggested as essential, but such claims have usually not been confirmed. Definitive evidence for efficacy comes from the characterization of a biomolecule containing the element with an identifiable and testable function. These include:
Bromine
Arsenic
Nickel
Fluorine
Boron
Lithium
Strontium
Silicon
Vanadium",116
Human nutrition,Vitamins,"Except for vitamin D, vitamins are essential nutrients, necessary in the diet for good health. Vitamin D can be synthesized in the skin in the presence of UVB radiation. (Many animal species can synthesize vitamin C, but humans cannot.) Certain vitamin-like compounds that are recommended in the diet, such as carnitine, are thought useful for survival and health, but these are not ""essential"" dietary nutrients because the human body has some capacity to produce them from other compounds. Moreover, thousands of different phytochemicals have recently been discovered in food (particularly in fresh vegetables), which may have desirable properties including antioxidant activity (see below); experimental demonstration has been suggestive but inconclusive. Other essential nutrients not classed as vitamins include essential amino acids (see above), essential fatty acids (see above), and the minerals discussed in the preceding section.Vitamin deficiencies may result in disease conditions: goiter, scurvy, osteoporosis, impaired immune system, disorders of cell metabolism, certain forms of cancer, symptoms of premature aging, and poor psychological health (including eating disorders), among many others.Excess levels of some vitamins are also dangerous to health. The Food and Nutrition Board of the Institute of Medicine has established Tolerable Upper Intake Levels (ULs) for seven vitamins.",266
