title,heading,content,tokens
Nutrition,Summary,"Nutrition is the biochemical and physiological process by which an organism uses food to support its life. It provides organisms with nutrients, which can be metabolized to create energy and chemical structures. Failure to obtain sufficient nutrients causes malnutrition. Nutritional science is the study of nutrition, though it typically emphasizes human nutrition.
The type of organism determines what nutrients it needs and how it obtains them. Organisms obtain nutrients by consuming organic matter, consuming inorganic matter, absorbing light, or some combination of these. Some can produce nutrients internally by consuming basic elements, while some must consume other organisms to obtain pre-existing nutrients. All forms of life require carbon, energy, and water as well as various other molecules. Animals require complex nutrients such as carbohydrates, lipids, and proteins, obtaining them by consuming other organisms. Humans have developed agriculture and cooking to replace foraging and advance human nutrition. Plants acquire nutrients through the soil and the atmosphere. Fungi absorb nutrients around them by breaking them down and absorbing them through the mycelium.",212
Nutrition,Study,"Scientific analysis of food and nutrients began during the chemical revolution in the late-18th century. Chemists in the 18th and 19th centuries experimented with different elements and food sources to develop theories of nutrition. Modern nutrition science began in the 1910s as individual micronutrients began to be identified. The first vitamin to be chemically identified was thiamine in 1926, and vitamin C was first to be found as a protection against scurvy in 1932. The role of vitamins in nutrition was studied in the following decades. The first recommended dietary allowances for humans were developed in fear of disease caused by food deficiencies around the time of the Great Depression and second world war. Due to its importance in human health, the study of nutrition has heavily emphasized human nutrition and agriculture, while ecology is a secondary concern.",166
Nutrition,Nutrients,"Nutrients are substances that provide energy and physical components to the organism, allowing it to survive, grow, and reproduce. Nutrients can be basic elements or complex macromolecules. Approximately 30 elements are found in organic matter, with nitrogen, carbon, and phosphorus being the most important. Macronutrients are the primary substances required by an organism, and micronutrients are substances required by an organism in trace amounts. Organic micronutrients are classified as vitamins, and inorganic micronutrients are classified as minerals.Nutrients are absorbed by the cells and used in metabolic biochemical reactions. These include fueling reactions that create precursor metabolites and energy, biosynthetic reactions that convert precursor metabolites into building block molecules, polymerizations that combine these molecules into macromolecule polymers, and assembly reactions that use these polymers to construct cellular structures.",175
Nutrition,Nutritional groups,"Organisms can be classified by how they obtain carbon and energy. Heterotrophs are organisms that obtain nutrients by consuming the carbon of other organisms, while autotrophs are organisms that produce their own nutrients from the carbon of inorganic substances like carbon dioxide. Mixotrophs are organisms that can be heterotrophs and autotrophs, including some plankton and carnivorous plants. Phototrophs obtain energy from light, while chemotrophs obtain energy by consuming chemical energy from matter. Organotrophs consume other organisms to obtain electrons, while lithotrophs obtain electrons from inorganic substances, such as water, hydrogen sulfide, dihydrogen, iron(II), sulfur, or ammonium. Prototrophs can create essential nutrients from other compounds, while auxotrophs must consume preexisting nutrients.",177
Nutrition,Diet,"In nutrition, the diet of an organism is the sum of foods it eats. A healthy diet improves the physical and mental health of an organism. This requires ingestion and absorption of vitamins, minerals, essential amino acids from protein and essential fatty acids from fat-containing food. Carbohydrates, protein and fat play a major role in ensuring the quality of life, health and longevity of the organism. Some cultures and religions may have restrictions on what is acceptable for their diet. A particular diet may be chosen to promote weight loss or weight gain, and in doing so increase or decrease the amount of fat stored by the body.",127
Nutrition,Nutrient cycle,"A nutrient cycle is a biogeochemical cycle involving the movement of inorganic matter through a combination of soil, organisms, air or water, where they are exchanged in organic matter. Energy flow is a unidirectional and noncyclic pathway, whereas the movement of mineral nutrients is cyclic. Mineral cycles include the carbon cycle, sulfur cycle, nitrogen cycle, water cycle, phosphorus cycle, and oxygen cycle, among others that continually recycle along with other mineral nutrients into productive ecological nutrition.Biogeochemical cycles that are performed by living organisms and natural processes are water, carbon, nitrogen, phosphorus, and sulfur cycles. Nutrient cycles allow these essential elements to return back into the environment after being absorbed or consumed. Without proper nutrient cycling, there would be risk of change in oxygen levels, climate, and ecosystem function.",167
Nutrition,Foraging,"Foraging is the process of seeking out nutrients in the environment. It may also be defined to include the subsequent use of the resources. Some organisms, such as animals and bacteria, can navigate to find nutrients, while others, such as plants and fungi, extend outward to find nutrients. Foraging may be random, in which the organism seeks nutrients without method, or it may be systematic, in which the organism can go directly to a food source. Organisms are able to detect nutrients through taste or other forms of nutrient sensing, allowing them to regulate nutrient intake. Optimal foraging theory is a model that explains foraging behavior as a cost–benefit analysis in which an animal must maximize the gain of nutrients while minimizing the amount of time and energy spent foraging. It was created to analyze the foraging habits of animals, but it can also be extended to other organisms. Some organisms are specialists that are adapted to forage for a single food source, while others are generalists that can consume a variety of food sources.",209
Nutrition,Nutrient deficiency,"Nutrient deficiencies, known as malnutrition, occur when an organism does not have the nutrients that it needs. This may be caused by suddenly losing nutrients or the inability to absorb proper nutrients. Not only is malnutrition the result from a lack of necessary nutrients, but it can also be a result from other underlying illnesses and health conditions. When this occurs, an organism will adapt by reducing energy consumption and expenditure to prolong the use of stored nutrients. It will use stored energy reserves until they are depleted, and it will then break down its own body mass for additional energy.A balanced diet involves the proper amount of all essential and nonessential nutrients. However, it can be different based on age, weight, sex, physical activity levels, and more. Lacking simply one essential nutrient can cause bodily harm, just as an overabundance can cause toxicity. The Daily Reference Values keep the majority of people from nutrient deficiencies. DRVs are not recommendations but a combination of nutrient references to educate professionals and policymakers on what the maximum and minimum nutrient intake are for the average person. Food labels also use DRVs as a reference to create safe nutritional guidelines for the average healthy person.",236
Nutrition,Animal,"Animals are heterotrophs that consume other organisms to obtain nutrients. Herbivores are animals that eat plants, carnivores are animals that eat other animals, and omnivores are animals that eat both plants and other animals. Many herbivores rely on bacterial fermentation to create digestible nutrients from indigestible plant cellulose, while obligate carnivores must eat animal meats to obtain certain vitamins or nutrients their bodies cannot otherwise synthesize. Animals generally have a higher requirement of energy in comparison to plants. The macronutrients essential to animal life are carbohydrates, amino acids, and fatty acids.All macronutrients except water are required by the body for energy, however, this is not their sole physiological function. The energy provided by macronutrients in food is measured in kilocalories, usually called Calories, where 1 Calorie is the amount of energy required to raise 1 kilogram of water by 1 degree Celsius.Carbohydrates are molecules that store significant amounts of energy. Animals digest and metabolize carbohydrates to obtain this energy. Carbohydrates are typically synthesized by plants during metabolism, and animals have to obtain most carbohydrates from nature, as they have only a limited ability to generate them. They include sugars, oligosaccharides, and polysaccharides. Glucose is the simplest form of carbohydrate. Carbohydrates are broken down to produce glucose and short-chain fatty acids, and they are the most abundant nutrients for herbivorous land animals.Lipids provide animals with fats and oils. They are not soluble in water, and they can store energy for an extended period of time. They can be obtained from many different plant and animal sources. Most dietary lipids are triglycerides, composed of glycerol and fatty acids. Phospholipids and sterols are found in smaller amounts. An animal's body will reduce the amount of fatty acids it produces as dietary fat intake increases, while it increases the amount of fatty acids it produces as carbohydrate intake increases.Protein consumed by animals is broken down to amino acids, which would be later used to synthesize new proteins. Protein is used to form cellular structures, fluids, and enzymes (biological catalysts). Enzymes are essential to most metabolic processes, as well as DNA replication, repair, and transcription.Much of animal behavior is governed by nutrition. Migration patterns and seasonal breeding take place in conjunction with food availability, and courtship displays are used to display an animal's health. Animals develop positive and negative associations with foods that affect their health, and they can instinctively avoid foods that have caused toxic injury or nutritional imbalances through a conditioned food aversion. Some animals, such as rats, do not seek out new types of foods unless they have a nutrient deficiency.",567
Nutrition,Human,"Early human nutrition consisted of foraging for nutrients similar to that of other animals, but it diverged at the beginning of the Holocene with the Neolithic Revolution, in which humans developed agriculture to produce food. The Chemical Revolution in the 18th century allowed humans to study the nutrients in foods and develop more advanced methods of food preparation. Major advances in economics and technology during the 20th century allowed mass production and food fortification to better meet the nutritional needs of humans. Human behavior is closely related to human nutrition, making it a subject of social science in addition to biology. Nutrition in humans is balanced with eating for pleasure, and optimal diet may vary depending on the demographics and health concerns of each person.Humans are omnivores that eat a variety of foods. Cultivation of cereals and production of bread has made up a key component of human nutrition since the beginning of agriculture. Early humans hunted animals for meat, and modern humans domesticate animals to consume their meat and eggs. The development of animal husbandry has also allowed humans in some cultures to consume the milk of other animals and produce it into foods such as cheese. Other foods eaten by humans include nuts, seeds, fruits, and vegetables. Access to domesticated animals as well as vegetable oils has caused a significant increase in human intake of fats and oils. Humans have developed advanced methods of food processing that prevents contamination of pathogenic microorganisms and simplify the production of food. These include drying, freezing, heating, milling, pressing, packaging, refrigeration, and irradiation. Most cultures add herbs and spices to foods before eating to add flavor, though most do not significantly affect nutrition. Other additives are also used to improve the safety, quality, flavor, and nutritional content of food.Humans obtain most carbohydrates as starch from cereals, though sugar has grown in importance. Lipids can be found in animal fat, butterfat, vegetable oil, and leaf vegetables, and they are also used to increase flavor in foods. Protein can be found in virtually all foods, as it makes up cellular material, though certain methods of food processing may reduce the amount of protein in a food. Humans can also obtain energy from ethanol, which is both a food and a drug, but it provides relatively few essential nutrients and is associated with nutritional deficiencies and other health risks.In humans, poor nutrition can cause deficiency-related diseases such as blindness, anemia, scurvy, preterm birth, stillbirth and cretinism, or nutrient excess health-threatening conditions such as obesity and metabolic syndrome; and such common chronic systemic diseases as cardiovascular disease, diabetes, and osteoporosis. Undernutrition can lead to wasting in acute cases, and stunting of marasmus in chronic cases of malnutrition.",558
Nutrition,Domesticated animal,"In domesticated animals, such as pets, livestock, and working animals, as well as other animals in captivity, nutrition is managed by humans through animal feed. Fodder and forage are provided to livestock. Specialized pet food has been manufactured since 1860, and subsequent research and development have addressed the nutritional needs of pets. Dog food and cat food in particular are heavily studied and typically include all essential nutrients for these animals. Cats are sensitive to some common nutrients, such as taurine, and require additional nutrients derived from meat. Large-breed puppies are susceptible to overnutrition, as small-breed dog food is more energy dense than they can absorb.",137
Nutrition,Plant,"Most plants obtain nutrients through inorganic substances absorbed from the soil or the atmosphere. Carbon, hydrogen, oxygen, nitrogen, and sulfur are essential nutrients that make up organic material in a plant and allow enzymic processes. These are absorbed ions in the soil, such as bicarbonate, nitrate, ammonium, and sulfate, or they are absorbed as gases, such as carbon dioxide, water, oxygen gas, and sulfur dioxide. Phosphorus, boron, and silicon are used for esterification. They are obtained through the soil as phosphates, boric acid, and silicic acid, respectively. Other nutrients used by plants are potassium, sodium, calcium, magnesium, manganese, chlorine, iron, copper, zinc, and molybdenum.Plants uptake essential elements from the soil through their roots and from the air (consisting of mainly nitrogen and oxygen) through their leaves. Nutrient uptake in the soil is achieved by cation exchange, wherein root hairs pump hydrogen ions (H+) into the soil through proton pumps. These hydrogen ions displace cations attached to negatively charged soil particles so that the cations are available for uptake by the root. In the leaves, stomata open to take in carbon dioxide and expel oxygen. Although nitrogen is plentiful in the Earth's atmosphere, very few plants can use this directly. Most plants, therefore, require nitrogen compounds to be present in the soil in which they grow. This is made possible by the fact that largely inert atmospheric nitrogen is changed in a nitrogen fixation process to biologically usable forms in the soil by bacteria.As these nutrients do not provide the plant with energy, they must obtain energy by other means. Green plants absorb energy from sunlight with chloroplasts and convert it to usable energy through photosynthesis.",371
Nutrition,Fungus,"Fungi are chemoheterotrophs that consume external matter for energy. Most fungi absorb matter through the root-like mycelium, which grows through the organism's source of nutrients and can extend indefinitely. The fungus excretes extracellular enzymes to break down surrounding matter and then absorbs the nutrients through the cell wall. Fungi can be parasitic, saprophytic, or symbiotic. Parasitic fungi attach and feed on living hosts, such as animals, plants, or other fungi. Saprophytic fungi feed on dead and decomposing organisms. Symbiotic fungi grow around other organisms and exchange nutrients with them.",133
Nutrition,Protist,"Protists include all eukaryotes that are not animals, plants, or fungi, resulting in great diversity between them. Algae are photosynthetic protists that can produce energy from light. Several types of protists use mycelium similar to those of fungi. Protozoa are heterotrophic protists, and different protozoa seek nutrients in different ways. Flagellate protozoa use a flagellum to assist in hunting for food, and some protozoa travel via infectious spores to act as parasites. Many protists are mixotrophic, having both phototrophic and heterotrophic characteristics. Mixotrophic protists will typically depend on one source of nutrients while using the other as a supplemental source or a temporary alternative when its primary source is unavailable.",164
Nutrition,Prokaryote,"Prokaryotes, including bacteria and archaea, vary greatly in how they obtain nutrients across nutritional groups. Prokaryotes can only transport soluble compounds across their cell envelopes, but they can break down chemical components around them. Some lithotrophic prokaryotes are extremophiles that can survive in nutrient-deprived environments by breaking down inorganic matter. Phototrophic prokaryotes, such as cyanobacteria and Chloroflexia, can engage in photosynthesis to obtain energy from sunlight. This is common among bacteria that form in mats atop geothermal springs. Phototrophic prokaryotes typically obtain carbon from assimilating carbon dioxide through the Calvin cycle.Some prokaryotes, such as Bdellovibrio and Ensifer, are predatory and feed on other single-celled organisms. Predatory prokaryotes seek out other organisms through chemotaxis or random collision, merge with the organism, degrade it, and absorb the released nutrients. Predatory strategies of prokaryotes include attaching to the outer surface of the organism and degrading it externally, entering the cytoplasm of the organism, or by entering the periplasmic space of the organism. Groups of predatory prokaryotes may forgo attachment by collectively producing hydrolytic enzymes.",269
Malnutrition,Summary,"Malnutrition occurs when an organism gets too few or too many nutrients, resulting in health problems. Specifically, it is ""a deficiency, excess, or imbalance of energy, protein and other nutrients"" which adversely affects the body's tissues and form. Malnutrition is not receiving the correct amount of nutrition. Malnutrition is increasing in children under the age of five due to providers who cannot afford or do not have access to adequate nutrition.Malnutrition is a category of diseases that includes undernutrition and overnutrition. Undernutrition is a lack of nutrients, which can result in stunted growth, wasting, and underweight. A surplus of nutrients causes overnutrition, which can result in obesity. In some developing countries, overnutrition in the form of obesity is beginning to appear within the same communities as undernutrition.Most clinical studies use the term 'malnutrition' to refer to undernutrition. However, the use of 'malnutrition' instead of 'undernutrition' makes it impossible to distinguish between undernutrition and overnutrition, a less acknowledged form of malnutrition. Accordingly, a 2019 report by The Lancet Commission suggested expanding the definition of malnutrition to include ""all its forms, including obesity, undernutrition, and other dietary risks."" The World Health Organization and The Lancet Commission have also identified ""[t]he double burden of malnutrition,"" which occurs from ""the coexistence of overnutrition (overweight and obesity) alongside undernutrition (stunted growth and wasting).""",295
Malnutrition,Prevalence,"It is estimated that nearly one in three persons globally has at least one form of malnutrition: wasting, stunting, vitamin or mineral deficiency, overweight, obesity, or diet-related noncommunicable diseases. Undernutrition is more common in developing countries. Stunting is more prevalent in urban slums than in rural areas. Studies on malnutrition have the population categorised into different groups including infants, under-five children, children, adolescents, pregnant women, adults and the elderly population. The use of different growth references in different studies leads to variances in the undernutrition prevalence reported in different studies. Some of the growth references used in studies include the
National Center for Health Statistics (NCHS) growth charts, WHO reference 2007, Centers for Disease Control and Prevention (CDC) growth charts, National Health and Nutrition Examination Survey (NHANES), WHO reference 1995, Obesity Task Force (IOTF) criteria and Indian Academy of Pediatrics (IAP) growth charts.",198
Malnutrition,In children,"The prevalence of undernutrition is highest among children under five. In 2020, 149 million children under five years old were stunted, 45 million were wasted, and 38.9 million were overweight or obese. The following year, an estimated 45% of deaths in children were linked to undernutrition. As of 2020, the prevalence of wasting among children under five in South Asia was reported to be 16% moderately or severely wasted. As of 2022, UNICEF reported this prevalence as having slightly improved, but still being at at 14.8%. In Asia, India has one of the highest burden of wasting with over 20% wasted children. However, the burden of undernutrition among under-five children in African countries is much higher. A pooled analysis of the prevalence of chronic undernutrition among under-five children in East Africa was identified to be 33.3%. This prevalence of undernutrition among under-five children ranged from 21.9% in Kenya to 53% in Burundi. In Tanzania, the prevalence of stunting, among children under five varied from 41% in lowland and 64.5% in highland areas. Undernutrition by underweight and wasting was 11.5% and 2.5% in lowland and 22.% and 1.4% in the highland areas of Tanzania respectively. In South Sudan, the prevalence of undernutrition explained by stunting, underweight and wasting in under-five children were 23.8%, 4.8% and 2.3% respectively.Vitamin A deficiency affects one third of children under age 5 around the world, leading to 670,000 deaths and 250,000–500,000 cases of blindness.",343
Malnutrition,In adults,"As of June 2021, 1.9 billion adults were overweight or obese, and 462 million adults were underweight. Globally, two billion people had iodine deficiency in 2017. In 2020, 900 million women and children had anemia, which is often caused by iron deficiency.Certain groups have higher rates of undernutrition, including elderly people and women (in particular while pregnant or breastfeeding children under five years of age). Undernutrition is an increasing health problem in people aged over 65 years, even in developed countries, especially among nursing home residents and in acute care hospitals. In the elderly, undernutrition is more commonly due to physical, psychological, and social factors, not a lack of food. Age-related reduced dietary intake due to chewing and swallowing problems, sensory decline, depression, imbalanced gut microbiome, poverty and loneliness are major contributors to undernutrition in the elderly population.",179
Malnutrition,Recent increase,"There has been a global increase in food insecurity and hunger over the past decade. In 2015, 795 million people (about one in ten people on earth) had undernutrition. In 2020, one in nine people in the world—or 820 million people worldwide—was hungry. In 2022, 1.3 billion people worldwide were estimated to be food insecure.These increases are partially related to the ongoing COVID-19 pandemic, which continues to highlight the weaknesses of current food and health systems. It has contributed to food insecurity, increasing hunger worldwide; meanwhile, lower physical activity during lockdowns has contributed to increases in overweight and obesity. In 2020, experts estimated that by the end of the year, the pandemic could double the number of people at risk of suffering acute hunger. Similarly, experts estimate that the prevalence of moderate and severe wasting could increase by 14% due to COVID-19; coupled with reductions in nutrition and health services coverage, this could result in over 128,000 additional deaths among children under 5 in 2020 alone. Although COVID-19 is less severe in children than in adults, the risk of severe disease increases with undernutrition.Other major causes of hunger include manmade conflicts, climate changes, and economic downturns.",254
