title,heading,content,tokens
Child nutrition in Australia,Susceptibility in the Australian culture,"Low socio economic groups are revealed to be more susceptible to poor nutritional patterns. This is due to lower levels of education and income, which is correlated with the inability to purchase nutritious whole foods or become more adequately educated on healthy dietary guidelines. Dr. Inglis, Dr. Ball and Dr. Crawford studied the influence of women in the household and concluded that ""Women are primarily responsible for dietary choices"" Woman who are required to work full-time alongside their husbands in a relatively mediocre job, were shown to place a decreased emphasis on nutrition and an increased emphasis on convenience, due to the nature of their busy lifestyle. Whereas women who come from privileged backgrounds were able to dedicate more time to researching nutrition as well as have the monetary resources to afford foods such as lean organic meats and vegetables.  Such foods can be made into nourishing meals from scratch, without relying on pre-packaged foods for conveniences, providing a nutrient dense, low kilo joule intake. The lack of health consciousness among people of lower socioeconomic groups, thus stems from the higher costs of nutritious food in relation to inferior food options as well as for convenience.Furthermore, a 2013 Public Health and Nutritional Organisation study, explored the inferior nutrition standards of lower socioeconomic groups within Australia. The study selected random households throughout Melbourne Australia, in order to examine the correlation between financial
conditions and the amount of fast food consumed within the Australian household. The study concluded that out of the 2500 households examined, 328 of the households who were also at the time experiencing financial difficulties, were more likely to purchase fast foods options rather than nutritional alternatives.
Thus to equalize the barrier between different socioeconomic groups, healthier food options should be made available at a more affordable price.
Indigenous Australians are a minority group that are also at risk of developing poor nutritional habits.
The remoteness of rural indigenous populations and their reduced exposure to nutritional regulations has resulted in a 2013 study revealing that 30% of Indigenous Australians between the ages of 15-18 are considered obese and 8% of indigenous children between 2-14 are considered under weight or malnourished. 2012-13 indigenous children between the ages of 2-14 were further surveyed and of this sample, 85% did not consume the recommended amounts of fruit or vegetables defined by the NHMRC. Poor dietary standards also extend to urban Indigenous Australians, as their diets are proven to include significant amounts of convenience foods, for reasons of lifestyle and affordability. The lack of health awareness is proven by the 97% of urban indigenous Australians who are unlikely to consume the recommended vegetable quota. Exercise for many Indigenous Australians is a redeeming nutritional factor. A 2013 national study revealed that Indigenous children dedicate on average 6.6 hours to daily physical activity. This daily physical activity output is higher than the average Caucasian child. However, for a nutritional lifestyle to be maintained dietary consumption must be in balance with physical activity.",589
Feeding tube,Summary,"A feeding tube is a medical device used to provide nutrition to people who cannot obtain nutrition by mouth, are unable to swallow safely, or need nutritional supplementation. The state of being fed by a feeding tube is called gavage, enteral feeding or tube feeding. Placement may be temporary for the treatment of acute conditions or lifelong in the case of chronic disabilities.
A variety of feeding tubes are used in medical practice. They are usually made of polyurethane or silicone. The diameter of a feeding tube is measured in French units (each French unit equals 1⁄3 mm). They are classified by the site of insertion and intended use.",134
Feeding tube,Medical uses,"There are dozens of conditions that may require tube feeding (enteral nutrition) to prevent or treat malnutrition. Conditions that necessitate feeding tubes include prematurity, failure to thrive (or malnutrition), neurologic and neuromuscular disorders, inability to swallow, anatomical and post-surgical malformations of the mouth and esophagus, cancer, Sanfilippo syndrome, and digestive disorders.",84
Feeding tube,Children,"Feeding tubes are used widely in children with excellent success for a wide variety of conditions. Some children use them temporarily until they are able to eat on their own, while other children require them for a longer time. Some children only use feeding tubes to supplement their oral diet, while others rely on them exclusively.",65
Feeding tube,Dementia,"People with advanced dementia who get feeding assistance rather than feeding tubes have better outcomes. Feeding tubes do not increase life expectancy for such people, or protect them from aspiration pneumonia. Feeding tubes can also increase the risk of pressure ulcers, require pharmacological or physical restraints, and lead to distress. In the final stages of dementia, assisted feeding may still be preferred over a feeding tube to bring benefits of palliative care and human interaction even when nutritional goals are not being met.",100
Feeding tube,ICU,Feeding tubes are often used in the intensive care unit (ICU) to provide nutrition to people who are critically ill while their medical conditions are addressed; as of 2016 there was no consensus as to whether nasogastric or gastric tubes led to better outcomes.,57
Feeding tube,Mechanical obstruction and dysmotility,"There is at least moderate evidence for feeding tubes improving outcomes for chronic malnutrition in people with cancers of the head and neck that obstruct the esophagus and would limit oral intake, people with advanced gastroparesis, and ALS. For long term use, gastric tubes appear to have better outcomes than nasogastric tubes.",72
Feeding tube,GI surgery,"People who have surgery on their throat or stomach often have a feeding tube while recovering from surgery; a tube leading through the nose and down to the middle part of the small intestine is used, or a tube is directly placed through the abdomen to the small intestine. There is some evidence to suggest that people with a tube through the nose were able to start eating normally sooner.",77
Feeding tube,Product types,"Medical nutrition companies make flavored products for drinking and unflavored for tube feeding. In the USA these are regulated as medical foods, which are defined in section 5(b) of the Orphan Drug Act (21 U.S.C. 360ee (b) (3)) as ""a food which is formulated to be consumed or administered enterally under the supervision of a physician and which is intended for the specific dietary management of a disease or condition for which distinctive nutritional requirements, based on recognized scientific principles, are established by medical evaluation.""",111
Feeding tube,Types,"The most common types of tubes include those placed through the nose, including nasogastric, nasoduodenal, and nasojejunal tubes, and those placed directly into the abdomen, such as a gastrostomy, gastrojejunostomy, or jejunostomy feeding tube.",66
Feeding tube,Nasogastric feeding tube,"A nasogastric feeding tube or NG-tube is passed through the nares (nostril), down the esophagus and into the stomach. This type of feeding tube is generally used for short term feeding, usually less than a month, though some infants and children may use an NG-tube longterm. Individuals who need tube feeding for a longer period of time are typically transitioned to a more permanent gastric feeding tube. The primary advantage of the NG-tube is that it is temporary and relatively non-invasive to place, meaning it can be removed or replaced at any time without surgery. NG-tubes can have complications, particularly related to accidental removal of the tube and nasal irritation. More specifically, when nasogastric or nasoenteric tubes are placed incorrectly, they can damage patients' vocal cords, lungs, or trachea, resulting in serious injuries or even death.In March 2022, Avanos Medical's Cortrak2 EAS recall, for instance, has been classified as a Class I recall by the FDA, following reports of injuries and patient deaths caused by misplaced nasoenteric or nasogastric tubes.",239
Feeding tube,Nasojejunal feeding tube,"A nasojejunal or NJ-tube is similar to an NG-tube except that it is threaded through the stomach and into the jejunum, the middle section of the small intestine. In some cases, a nasoduodenal or ND-tube may be placed into the duodenum, the first part of the small intestine. These types of tube are used for individuals who are unable to tolerate feeding into the stomach, due to dysfunction of the stomach, impaired gastric motility, severe reflux or vomiting. These types of tubes must be placed in a hospital setting.",125
Feeding tube,Gastrostomy or gastric feeding tube,"A gastric feeding tube (G-tube or ""button"") is a tube inserted through a small incision in the abdomen into the stomach and is used for long-term enteral nutrition. One type is the percutaneous endoscopic gastrostomy (PEG) tube which is placed endoscopically. The position of the endoscope can be visualized on the outside of the person's abdomen because it contains a powerful light source. A needle is inserted through the abdomen, visualized within the stomach by the endoscope, and a suture passed through the needle is grasped by the endoscope and pulled up through the esophagus. The suture is then tied to the end of the PEG tube that will be external, and pulled back down through the esophagus, stomach, and out through the abdominal wall. The insertion takes about 20 minutes. The tube is kept within the stomach either by a balloon on its tip (which can be deflated) or by a retention dome which is wider than the tract of the tube. G-tubes may also be placed surgically, using either an open or laparoscopic technique.Gastric feeding tubes are suitable for long-term use, though they sometimes need to be replaced if used long-term. The G-tube can be useful where there is difficulty with swallowing because of neurologic or anatomic disorders (stroke, esophageal atresia, tracheoesophageal fistula, radiotherapy for head and neck cancer), and to decrease the risk of aspiration pneumonia. However, in people with advanced dementia or adult failure to thrive it does not decrease the risk of pneumonia. There is moderate quality evidence suggesting that the risk of aspiration pneumonia may be reduced by inserting the feeding tube into the duodenum or the jejunum (post-pyloric feeding), when compared to inserting the feeding tube into the stomach. People with dementia may attempt to remove the PEG, which causes complications.",409
Feeding tube,Gastric drainage tube,"A G-tube may instead be used for gastric drainage as a longer-term solution to the condition where blockage in the proximal small intestine causes bile and acid to accumulate in the stomach, typically leading to periodic vomiting, or if the vagus nerve is damaged. Where such conditions are only short term, as in a hospital setting, a nasal tube connected to suction is usually used. A blockage lower in the intestinal tract may be addressed with a surgical procedure known as a colostomy, and either type of blockage may be corrected with a bowel resection under appropriate circumstances. If such correction is not possible or practical, nutrition may be supplied by parenteral nutrition.",147
Feeding tube,Gastrojejunal feeding tube,"A gastrojejunostomy or GJ feeding tube is a combination device that includes access to both the stomach and the jejunum, or middle part of the small intestine. Typical tubes are placed in a G-tube site or stoma, with a narrower long tube continuing through the stomach and into the small intestine. The GJ-tube is used widely in individuals with severely impaired gastric motility, high risk of aspiration, or an inability to feed into the stomach. It allows the stomach to be continually vented or drained while simultaneously feeding into the small intestine. GJ-tubes are typically placed by an interventional radiologist in a hospital setting. The primary complication of a GJ-tube is migration of the long portion of the tube out of the intestine and back into the stomach.",167
Feeding tube,Jejunal feeding tube,A jejunostomy feeding tube (J-tube) is a tube surgically or endoscopically inserted through the abdomen and into the jejunum (the second part of the small intestine).,45
Feeding tube,Complications,"Nasogastric and nasojejeunal tubes are meant to convey liquid food to the stomach or intestines. When inserted incorrectly, the tip may rest in the respiratory system instead of the stomach or intestines; in this case, the liquid food will enter the lungs, resulting in pneumonia and can, in rare cases, lead to death.Complications associated with gastrostomy tubes (inserted through the abdomen and into the stomach or intestines) include leakage of gastric contents (containing hydrochloric acid) around the tube into the abdominal (peritoneal) cavity resulting in peritonitis, a serious complication which will cause death if it is not properly treated. Septic shock is another possible complication. Minor leakage may cause irritation of the skin around the gastrostomy site or stoma. Barrier creams, to protect the skin from the corrosive acid, are used to manage this.A phenomenon called ""tube dependency"" has been discussed in the medical literature, in which a child refuses to eat after being on a feeding tube, but it is not recognized as a disorder in the ICD or DSM and its epidemiology is unknown.",237
Feeding tube,Oral and dental complications,"Guidelines for dental care for children fed by tube are poorly established. Many dental complications arise due to poor oral health that may result from reluctance or intolerance towards oral hygiene practices by patients and caregivers, abundance of dental plaque and/or tooth decay, and lack of oral simulation. Although many studies on this topic involve a relatively small sample size, the findings are important as they are associated with the development of various oral conditions, dental diseases and even systemic diseases such as aspiration pneumonia.",100
Feeding tube,Calculus,"Adults fed by tube have previously shown a significantly higher rate and quantity of calculus deposition than adults fed orally. Even with an intensive oral hygiene program in place, adults fed by tube still demonstrate a greater quantity of supra-gingival calculus accumulation, which can be a risk factor for several oral diseases including periodontal diseases and aspiration pneumonia. Although calculus removal may be difficult for caregivers to perform and provide an unpleasant experience for patients with a feeding tube, the implications of calculus in the initiation of aspiration pneumonia make it clear that it poses a serious health risk. Research suggests that the best course of treatment for patients with a gastric tube is periodic professional cleaning, maintained with routine home use of a non-foaming anti-calculus dentifrice (toothpaste).",157
Feeding tube,Caries,"Dental caries is a localized disease in which susceptible tooth structure is broken down by bacteria that are able to ferment carbohydrates into acid. Although it has not been extensively studied, researchers speculate that individuals fed by tube may be less prone to the development of caries as they are not exposed to carbohydrates orally. Examination of dental plaque from tube-fed individuals found that it contained fewer caries-associated microorganisms (lactobacilli and streptococcus) and had reduced ability to produce acids, suggesting an overall weaker ability to cause caries. Further, studies with animal subjects found that tube-feeding was not associated with tooth decay, even when combined with reduced salivation. Thus, tube-feeding alone does not necessarily directly promote the development of caries.",157
Feeding tube,Periodontal diseases,"To date, no published studies have been conducted on periodontal disease indicators (including clinical attachment loss, pocket depth, or periodontal indices) among tube-fed individuals. However, since tube feeding is correlated with calculus build-up, which is known to be a risk factor in the development of periodontal diseases, further investigation is critical to determine what role tube-feeding might have in the development of periodontal disease.",91
Feeding tube,Dental erosion,"Dental erosion is the dissolution of the tooth’s hard structures (enamel, dentin & cementum) by exposure to acids not caused by bacteria. In the case of individuals fed by gastric tube, acid may enter the oral cavity through reflux of gastric contents. Gastroesophageal reflux (GER) affects up to 67% of children and young adults with central nervous system dysfunction, a condition which in itself is normally an indicator for tube feeding. The effects of gastric acid on the teeth may sometimes be masked or minimized by the abundance of calculus. Tube feeding may either resolve, exacerbate or introduce the issue of GER in individuals.",138
Feeding tube,Aspiration pneumonia,"Individuals fed by tube are susceptible to aspiration through a multitude of factors. Firstly, undisturbed plaque is known to shift towards the type of bacteria (Gram-negative anaerobic) implicated in aspiration pneumonia. Additionally, tube-fed patients are commonly affected by gastroesophageal reflux and a breakdown in the airway protection reflex (breathing while swallowing). This results in the inadvertent inhalation of bacteria-containing gastric juices as they are re-swallowed, leading to the development of aspiration pneumonia.",111
Feeding tube,Oral hypersensitivity,"While a child undergoes a period of tube-feeding, there is a lack of oral stimulation that can lead to the development of oral hypersensitivity. This can complicate the delivery of dental care and serve as a barrier for the child’s return to oral feeding. This can also lead to dysphagia (difficulty swallowing), muscle weakness and improper airway protection, resulting in longer periods of tube-feeding and increased risk of dental complications. A dentist may prescribe a “desensitization program”, which involves routine stimulation of intra-oral and extra-oral structures, and encourage oral hygiene procedures to be performed at home.",133
Feeding tube,History,"While enemas were previously used for supplemental enteral nutrition, the practice of surgically inserting feeding tubes emerged in the mid to late 1800s. Initially, these procedures were largely unsuccessful, but they quickly improved with advancements in technique.Originally, the nasogastric tube (NGT) was described by John Hunter in the 18th century as a combination of eelskin and whalebone. It was initially utilized to provide liquid nutrition to the ill.",95
Universal Declaration on the Eradication of Hunger and Malnutrition,Summary,"The Universal Declaration on the Eradication of Hunger and Malnutrition  was adopted on 16 November 1974, by governments who attended the 1974 World Food Conference that was convened under General Assembly resolution 3180 (XXVIII) of 17 December 1973. It was later endorsed by General Assembly resolution 3348 (XXIX), of 17 December 1974. This Declaration combined discussions of the international human right to adequate food and nutrition with an acknowledgement of the various economic and political issues that can affect the production and distribution of food related products. Within this Declaration, it is recognised that it is the common purpose of all nations to work together towards eliminating hunger and malnutrition. Further, the Declaration explains how the welfare of much of the world's population depends on their ability to adequately produce and distribute food. In doing so, it emphasises the need for the international community to develop a more adequate system to ensure that the right to food for all persons is recognised. The opening paragraph of the Declaration, which remains to be the most recited paragraph of the Declaration today, reads:

Every man, woman and child has the inalienable right to be free from hunger and malnutrition in order to develop fully and maintain their physical and mental faculties. 

The Universal Declaration on the Eradication of Hunger and Malnutrition affirmed that it is a fundamental human right to be free from hunger and malnutrition, so that one can develop both their mental and physical faculties fully. This Declaration arose out of ever-growing concerns regarding worldwide famine, and in doing so, stressed that every country that is in a position to be able to assist developing nations to gain access to more, better quality food, has the responsibility to ensure that this right to food is realized.",350
Universal Declaration on the Eradication of Hunger and Malnutrition,Precursors,"The prevalence of hunger and malnutrition is an issue that has long been of international concern. Although it has been accepted that obtaining exact statistics regarding world hunger is difficult, it is believed that in the early 1960s, there were approximately 900 million undernourished individuals worldwide. The majority of these individuals were located in developing nations such as Africa, Asia and Latin America. It is believed that today, one in every nine individuals do not have an adequate access to food. Hunger and malnutrition have now been identified as the cause of more deaths worldwide than AIDS, malaria and tuberculosis combined. Today it is estimated that there are approximately 1.02 billion people across the world living in conditions of extreme hunger, 1 billion of whom live in developing countries. Hunger and malnutrition have been of growing concern throughout the international community, despite a number of intervention attempts from the likes of States and non-government organisations. The right to food, for example, was asserted in the 1948 Universal Declaration of Human Rights (UDHR), and was again recognised in 1966 through Article 11 of the International Covenant on Economic, Social and Cultural Rights.
Leading up to the drafting and formation of the Universal Declaration on the Eradication of Hunger and Malnutrition, the international community as a whole was becoming increasingly aware of the severity of the worldwide issue of hunger and malnutrition, and identified an immediate need for some form of action to combat this. This growing concern was an important factor leading to the first World Food Conference convening in Rome in 1974 in an attempt to uncover an adequate solution in order to combat this issue.",318
Universal Declaration on the Eradication of Hunger and Malnutrition,Adoption,"Representatives from 135 countries attended the 1974 World Food Conference where this Declaration was adopted. As well as these State representatives, a number of libertarian movements, United Nations bodies and intergovernmental organisations were also present at this Conference. Representatives from the following countries were present for the formation of the Universal Declaration on the Eradication of Hunger and Malnutrition:",72
Universal Declaration on the Eradication of Hunger and Malnutrition,Structure,"The Declaration in itself is 12 paragraphs. Many of these paragraphs have now been elaborated on in subsequent international human rights treaties and regional human rights instruments. Throughout these paragraphs, the intended purposes, functions and goals of this Declaration are set out. A number of these paragraphs are worth further consideration. 

Paragraph A) brings attention to the grave nature of the international food crisis, and highlights the vast imbalance between the resources found in developing countries and those found in developed countries.
Paragraph C) recognises that this international food crises arose from various historical circumstances, such as colonisation and racial discrimination.
Paragraph D) expands on this point about historical circumstances and discusses how recent international economic crises have worked to further prolong and aggravate this problem.
Paragraph F) recognises that all countries, regardless of their size, population or economic status must be considered equal.
Paragraph I) identifies that any lasting solution to this food crises is also going to need to attempt to decrease the ever-growing gap between developed and developing countries, in order to bring about a “new international economic order.""
Paragraph K) of the Declaration recognises that developing countries are not always able to meet the food requirements of their people of their own merits, and therefore acknowledges that urgent and effective action needs to be taken by the international community, and this should be free from political pressures.",282
